{
  "contract_version": "1.0",
  "id": "api-framework",
  "concern": "HTTP API framework",
  "candidates": [
    {
      "name": "fastapi",
      "version": "0.115.2",
      "license": "MIT",
      "maturity": {
        "last_release": "2026-09-01",
        "maintainers": 5,
        "stars": 80000
      },
      "fit": "async API with typed models",
      "risks": [
        "major version churn"
      ],
      "risky": false,
      "spike": {
        "command": "python spike.py",
        "result": "not-run",
        "evidence": ""
      }
    }
  ],
  "decision": "open",
  "adr": "ADR-0003"
}
